original_summary,finetuned_summary,reference_summary,original_rouge1,original_rouge2,original_rougeL,original_rougeLsum,finetuned_rouge1,finetuned_rouge2,finetuned_rougeL,finetuned_rougeLsum
The reopening of the Caminito del Rey is a milestone in the Spanish tourism industry.,The reopening of the Spanish tourist attraction in the north-eastern region of the country has been a major step forward for the first time.,"Spain's '""most dangerous path"" due to reopen this month after extensive reconstruction efforts .
Originally built in the 1900s, the trail's boardwalks deteriorated over time, forcing the local government to close it .",0.18647456213170355,0.05167592630123461,0.14599432721861988,0.1643046379238954,0.2201708150956731,0.04096838480803657,0.16134511051515477,0.18440087670415412
"Israel.""",Israel's President Mahmoud Herzog has said he will not accept a general election in the next few weeks.,"Polls show Isaac Herzog's Zionist Union party four seats ahead of Benjamin Netanyahu's party .
Israeli parliamentary elections will be on March 17 .",0.18647456213170355,0.05167592630123461,0.14599432721861988,0.1643046379238954,0.2201708150956731,0.04096838480803657,0.16134511051515477,0.18440087670415412
Brazil's president.,"Brazil's President Dilma Rousseff has been accused of corruption, but she has been a member of the Brazilian parliament.","CNN's Shasta Darlington, who lives in Sao Paulo, explains who protesters are and what they want .
Demonstrators are angry about a massive scandal involving state oil company .
Protesters also are incensed about a stumbling economy .",0.18647456213170355,0.05167592630123461,0.14599432721861988,0.1643046379238954,0.2201708150956731,0.04096838480803657,0.16134511051515477,0.18440087670415412
"Indonesian officials have detained 16 Indonesian citizens who confessed they were planning to cross the border into Syria, the foreign ministry said.","Indonesia has arrested 16 Indonesians who have been smugglers in Syria, the country's foreign ministry says.","The group is made up of one man, four women, 11 children .
They were stopped just north of Aleppo, Syria .",0.18647456213170355,0.05167592630123461,0.14599432721861988,0.1643046379238954,0.2201708150956731,0.04096838480803657,0.16134511051515477,0.18440087670415412
